{"schema":"opening-cross/fairness-proof/v1","program":"F5k8EDDXBF24xgt4Y8MMtwPZFH9TikJvJcNmD1NJQPnZ","cross":"AkJC44mFaXbsW8MmFkpTxoLP3qhfmEDsHs1j5hN6tmLP","state":"Finalized","params":{"minPrice":"1000000","tick":"50000","ticks":40,"priceScale":"1000000","referencePrice":null,"minMatched":"0","maxImbalanceBps":null,"oracleGuard":false},"book":[{"price":"1200000","buy":"0","sell":"1000000000","buyOrders":0,"sellOrders":1},{"price":"1300000","buy":"600000000","sell":"0","buyOrders":1,"sellOrders":0}],"onchain":{"printed":true,"price":"1200000","matched":"600000000","rationed":"sell","noPrintReason":null},"recomputed":{"printed":true,"price":"1200000","matched":"600000000","rationed":"sell","noPrintReason":null},"verified":true,"notes":[]}