{"schema":"opening-cross/fairness-proof/v1","program":"F5k8EDDXBF24xgt4Y8MMtwPZFH9TikJvJcNmD1NJQPnZ","cross":"5UfrmxAv1qQakpSp8fJ8yD2Jx3nekb4nu8HjsF2wA8Wm","state":"Finalized","params":{"minPrice":"1000000","tick":"100000","ticks":20,"priceScale":"1000000","referencePrice":null,"minMatched":"0","maxImbalanceBps":null,"oracleGuard":false},"book":[{"price":"1000000","buy":"0","sell":"1000000000","buyOrders":0,"sellOrders":1},{"price":"1100000","buy":"500000000","sell":"0","buyOrders":1,"sellOrders":0},{"price":"1200000","buy":"800000000","sell":"1000000000","buyOrders":1,"sellOrders":1},{"price":"1500000","buy":"1500000000","sell":"1000000000","buyOrders":1,"sellOrders":1}],"onchain":{"printed":true,"price":"1200000","matched":"2000000000","rationed":"buy","noPrintReason":null},"recomputed":{"printed":true,"price":"1200000","matched":"2000000000","rationed":"buy","noPrintReason":null},"verified":true,"notes":[]}