{"schema":"opening-cross/fairness-proof/v1","program":"F5k8EDDXBF24xgt4Y8MMtwPZFH9TikJvJcNmD1NJQPnZ","cross":"HaoQFsbYypLjdC5jaqH66AAtyWMSHCc4og7LF1ZXiEtE","state":"Finalized","params":{"minPrice":"1000000","tick":"50000","ticks":40,"priceScale":"1000000","referencePrice":null,"minMatched":"0","maxImbalanceBps":null,"oracleGuard":false},"book":[{"price":"1200000","buy":"0","sell":"1000000000","buyOrders":0,"sellOrders":1}],"onchain":{"printed":false,"price":null,"matched":null,"rationed":null,"noPrintReason":0},"recomputed":{"printed":false,"price":null,"matched":null,"rationed":null,"noPrintReason":"NoCross"},"verified":true,"notes":[]}