{"schema":"opening-cross/fairness-proof/v1","program":"F5k8EDDXBF24xgt4Y8MMtwPZFH9TikJvJcNmD1NJQPnZ","cross":"EEcjzWRq3q6Bvkjzb8XcncAN7eDVpt2baqG4HTNkXyAZ","state":"Live","params":{"minPrice":"1000000","tick":"50000","ticks":60,"priceScale":"1000000","referencePrice":null,"minMatched":"0","maxImbalanceBps":null,"oracleGuard":false},"book":[],"onchain":{"printed":false,"price":null,"matched":null,"rationed":null,"noPrintReason":null},"recomputed":{"printed":false,"price":null,"matched":null,"rationed":null,"noPrintReason":null},"verified":false,"notes":["The cross has not cleared yet; nothing to verify."]}